"infinitive","english","present","simple_past","present_perfect","example"
"wegvallen","to fall away - to disappear","val weg","viel weg","ben weggevallen","De financiële steun valt plotseling weg."
"doorbreken","to break through","doorbreek","doorbrak","heb doorbroken","We doorbreken de oude gewoonte."
"uitmonden","to result in","mond uit","mondde uit","is uitgemond","Het protest mondt uit in geweld."
"aanscherpen","to tighten","scherp aan","scherpte aan","heb aangescherpt","De overheid scherpt de regels aan."
"voortkomen","to stem from","kom voort","kwam voort","ben voortgekomen","Het conflict komt uit een misverstand voort."
"bijstellen","to adjust","stel bij","stelde bij","heb bijgesteld","Ik stel mijn hoge verwachtingen bij."
"inperken","to curtail","perk in","perkte in","heb ingeperkt","De wet perkt onze vrijheid in."
"verschuilen","to hide behind","verschuil","verschuilde","heb verschuild","Hij verschuilt zich achter de regels."
"betogen","to argue - to demonstrate","betoog","betoogde","heb betoogd","De auteur betoogt dat verandering nodig is."
