"infinitive","english","present","simple_past","present_perfect","example"
"onderhandelen","to negotiate","onderhandel","onderhandelde","heb onderhandeld","We onderhandelen lang over de prijs."
"beïnvloeden","to influence","beïnvloed","beïnvloedde","heb beïnvloed","Reclame beïnvloedt ons gedrag enorm."
"ontwikkelen","to develop","ontwikkel","ontwikkelde","heb ontwikkeld","Het bedrijf ontwikkelt nieuwe producten."
"bevestigen","to confirm","bevestig","bevestigde","heb bevestigd","Ik bevestig de afspraak per mail."
"benadrukken","to emphasize","benadruk","benadrukte","heb benadrukt","Hij benadrukt het belang van veiligheid."
"beschouwen","to consider - to regard","beschouw","beschouwde","heb beschouwd","Ik beschouw hem als een goede vriend."
"beschrijven","to describe","beschrijf","beschreef","heb beschreven","Beschrijf de situatie even in detail."
"beoordelen","to assess - to judge","beoordeel","beoordeelde","heb beoordeeld","De docent beoordeelt alle essays zorgvuldig."
"samenwerken","to collaborate","werk samen","werkte samen","heb samengewerkt","We werken graag met andere collega's samen."
"toepassen","to apply","pas toe","paste toe","heb toegepast","Ik pas de nieuwe regels meteen toe."
"vermijden","to avoid","vermijd","vermeed","heb vermeden","Probeer onnodige stress zoveel mogelijk te vermijden."
"veroorzaken","to cause","veroorzaak","veroorzaakte","heb veroorzaakt","Roken veroorzaakt veel ernstige ziektes."
"voorkomen","to prevent","voorkom","voorkwam","heb voorkomen","We willen toekomstige ongelukken voorkomen."
"vaststellen","to establish - to determine","stel vast","stelde vast","heb vastgesteld","De arts stelt de juiste diagnose vast."
"verwerken","to process","verwerk","verwerkte","heb verwerkt","Ik verwerk de gegevens in een rapport."
"aanpassen","to adjust - to adapt","pas aan","paste aan","heb aangepast","Ik pas mijn planning aan het weer aan."
"overtuigen","to convince","overtuig","overtuigde","heb overtuigd","Hij overtuigt me van zijn gelijk."
"vertegenwoordigen","to represent","vertegenwoordig","vertegenwoordigde","heb vertegenwoordigd","Zij vertegenwoordigt het bedrijf op de beurs."
"verminderen","to reduce","verminder","verminderde","heb verminderd","We verminderen het aantal fouten flink."
"vergroten","to enlarge - to increase","vergroot","vergrootte","heb vergroot","Goede voorbereiding vergroot de kans op succes."
"afhangen","to depend","hang af","hing af","heb afgehangen","Dat hangt helemaal van het weer af."
"bestaan","to exist","besta","bestond","heb bestaan","Dit bedrijf bestaat al honderd jaar."
"beschikken","to have at one's disposal","beschik","beschikte","heb beschikt","Ik beschik over voldoende tijd en geld."
"functioneren","to function","functioneer","functioneerde","heb gefunctioneerd","De oude machine functioneert nog prima."
"presteren","to perform","presteer","presteerde","heb gepresteerd","Hij presteert uitstekend op zijn werk."
"realiseren","to realize - to achieve","realiseer","realiseerde","heb gerealiseerd","Ik realiseer me het probleem nu pas."
"uitvoeren","to carry out - to execute","voer uit","voerde uit","heb uitgevoerd","We voeren het plan zorgvuldig uit."
"waarschuwen","to warn","waarschuw","waarschuwde","heb gewaarschuwd","Ik waarschuw je voor het grote gevaar."
"ondersteunen","to support","ondersteun","ondersteunde","heb ondersteund","Wij ondersteunen dit goede doel van harte."
"bekritiseren","to criticize","bekritiseer","bekritiseerde","heb bekritiseerd","De pers bekritiseert de minister streng."
"verantwoorden","to justify - to account for","verantwoord","verantwoordde","heb verantwoord","Hij moet zijn moeilijke keuze verantwoorden."
"bereiken","to reach - to achieve","bereik","bereikte","heb bereikt","Samen bereiken we ons grote doel."
"concluderen","to conclude","concludeer","concludeerde","heb geconcludeerd","Ik concludeer dat het systeem werkt."
"overwegen","to consider","overweeg","overwoog","heb overwogen","Ik overweeg serieus een nieuwe baan."
"toenemen","to increase","neem toe","nam toe","ben toegenomen","De werkdruk neemt de laatste tijd toe."
"afnemen","to decrease","neem af","nam af","ben afgenomen","De interesse neemt langzaam maar zeker af."
"erkennen","to acknowledge","erken","erkende","heb erkend","Hij erkent eerlijk zijn eigen fouten."
"inschatten","to estimate","schat in","schatte in","heb ingeschat","Ik schat de kosten verkeerd in."
"verschijnen","to appear - to be published","verschijn","verscheen","ben verschenen","Het rapport verschijnt volgende maand."
"toekennen","to grant - to award","ken toe","kende toe","heb toegekend","De jury kent hem de eerste prijs toe."
"aankondigen","to announce","kondig aan","kondigde aan","heb aangekondigd","De regering kondigt nieuwe maatregelen aan."
"aanmoedigen","to encourage","moedig aan","moedigde aan","heb aangemoedigd","Ouders moedigen hun kinderen aan."
"aanvallen","to attack","val aan","viel aan","heb aangevallen","Het leger valt de stad in het zuiden aan."
"aanwijzen","to point out - to designate","wijs aan","wees aan","heb aangewezen","De directeur wijst een opvolger aan."
"afleiden","to distract - to deduce","leid af","leidde af","heb afgeleid","Lawaai leidt me snel af."
"afwijzen","to reject","wijs af","wees af","heb afgewezen","Ze wijzen mijn voorstel helaas af."
"begeleiden","to guide - to accompany","begeleid","begeleidde","heb begeleid","Ik begeleid de nieuwe collega's."
"belasten","to burden - to tax","belast","belastte","heb belast","De overheid belast hoge inkomens zwaar."
"belonen","to reward","beloon","beloonde","heb beloond","De baas beloont altijd goed werk."
"benaderen","to approach","benader","benaderde","heb benaderd","Ik benader het probleem anders."
"benoemen","to appoint - to name","benoem","benoemde","heb benoemd","Ze benoemen hem tot nieuwe directeur."
"bepalen","to determine","bepaal","bepaalde","heb bepaald","Het weer bepaalt onze plannen vandaag."
"beperken","to limit","beperk","beperkte","heb beperkt","We beperken de kosten zoveel mogelijk."
"beschuldigen","to accuse","beschuldig","beschuldigde","heb beschuldigd","Hij beschuldigt mij van diefstal."
"betreffen","to concern","betreft","betrof","heeft betroffen","Dit besluit betreft alle medewerkers."
"betrekken","to involve","betrek","betrok","heb betrokken","We betrekken de buurt bij het plan."
"betreuren","to regret","betreur","betreurde","heb betreurd","Ik betreur deze vervelende situatie."
"beweren","to claim","beweer","beweerde","heb beweerd","Hij beweert dat hij onschuldig is."
"bewijzen","to prove","bewijs","bewees","heb bewezen","Zij bewijst haar gelijk met feiten."
"bezitten","to own - to possess","bezit","bezat","heb bezeten","Hij bezit een heel groot bedrijf."
"bijdragen","to contribute","draag bij","droeg bij","heb bijgedragen","Iedereen draagt aan het project bij."
"binden","to bind - to tie","bind","bond","heb gebonden","Het contract bindt beide partijen."
"boeien","to fascinate","boei","boeide","heb geboeid","Het onderwerp boeit me enorm."
"dwingen","to force","dwing","dwong","heb gedwongen","Niemand dwingt je tot deze keuze."
"financieren","to finance","financier","financierde","heb gefinancierd","De bank financiert het nieuwe project."
"garanderen","to guarantee","garandeer","garandeerde","heb gegarandeerd","Wij garanderen een snelle levering."
"gelden","to apply - to be valid","geld","gold","heb gegolden","Deze regel geldt voor iedereen."
"handhaven","to maintain - to enforce","handhaaf","handhaafde","heb gehandhaafd","De politie handhaaft de openbare orde."
"herstellen","to recover - to repair","herstel","herstelde","ben hersteld","De patiënt herstelt langzaam."
"hervormen","to reform","hervorm","hervormde","heb hervormd","De minister hervormt het hele stelsel."
"inhouden","to entail - to withhold","houd in","hield in","heb ingehouden","Wat houdt deze functie precies in?"
"leiden","to lead","leid","leidde","heb geleid","Zij leidt een groot team."
"naderen","to approach","nader","naderde","is genaderd","De trein nadert nu het station."
"onderbreken","to interrupt","onderbreek","onderbrak","heb onderbroken","Sorry dat ik je even onderbreek."
"ondergaan","to undergo","onderga","onderging","heb ondergaan","De patiënt ondergaat een zware operatie."
"ondernemen","to undertake","onderneem","ondernam","heb ondernomen","We ondernemen meteen actie."
"onderscheiden","to distinguish","onderscheid","onderscheidde","heb onderscheiden","Ik onderscheid de twee soorten goed."
"onderzoeken","to investigate","onderzoek","onderzocht","heb onderzocht","De politie onderzoekt de zaak grondig."
"ontbreken","to be missing","ontbreek","ontbrak","heb ontbroken","Er ontbreekt een pagina in het rapport."
"ontkennen","to deny","ontken","ontkende","heb ontkend","Hij ontkent alle beschuldigingen."
"ontslaan","to fire - to dismiss","ontsla","ontsloeg","heb ontslagen","Het bedrijf ontslaat veel werknemers."
"ontstaan","to arise - to originate","ontsta","ontstond","ben ontstaan","Er ontstaat een fel debat."
"ontvangen","to receive","ontvang","ontving","heb ontvangen","Ik ontvang elke maand mijn salaris."
"opdragen","to assign - to order","draag op","droeg op","heb opgedragen","De baas draagt mij een taak op."
"oplossen","to solve","los op","loste op","heb opgelost","We lossen het probleem samen op."
"opleveren","to yield - to deliver","lever op","leverde op","heb opgeleverd","Het harde werk levert veel geld op."
"opleiden","to train - to educate","leid op","leidde op","heb opgeleid","De school leidt goede vakmensen op."
"opmerken","to remark - to notice","merk op","merkte op","heb opgemerkt","Hij merkt op dat ik te laat ben."
"oproepen","to call up - to evoke","roep op","riep op","heb opgeroepen","De minister roept op tot kalmte."
"opstellen","to draw up - to set up","stel op","stelde op","heb opgesteld","Ik stel een nieuw contract op."
"oordelen","to judge","oordeel","oordeelde","heb geoordeeld","Oordeel niet te snel over anderen."
"overdrijven","to exaggerate","overdrijf","overdreef","heb overdreven","Hij overdrijft altijd zijn prestaties."
"overhandigen","to hand over","overhandig","overhandigde","heb overhandigd","Ik overhandig hem de eerste prijs."
"overtreffen","to surpass","overtref","overtrof","heb overtroffen","De resultaten overtreffen onze verwachtingen."
"overtreden","to violate","overtreed","overtrad","heb overtreden","Hij overtreedt vaak de verkeersregels."
"plaatsen","to place","plaats","plaatste","heb geplaatst","Ik plaats een bericht op de website."
"pleiten","to plead - to argue","pleit","pleitte","heb gepleit","Ik pleit voor een betere oplossing."
"raadplegen","to consult","raadpleeg","raadpleegde","heb geraadpleegd","Ik raadpleeg eerst een deskundige."
"regeren","to rule - to govern","regeer","regeerde","heb geregeerd","De koning regeert het land niet echt."
"reiken","to reach - to extend","reik","reikte","heb gereikt","Zijn invloed reikt heel ver."
"richten","to aim - to direct","richt","richtte","heb gericht","Ik richt me op de belangrijkste taken."
"schatten","to estimate","schat","schatte","heb geschat","Ik schat de afstand op tien kilometer."
"scheppen","to create","schep","schiep","heb geschapen","De regering schept veel nieuwe banen."
"schenden","to violate","schend","schond","heb geschonden","Hij schendt het vertrouwen van zijn collega's."
"schikken","to arrange - to suit","schik","schikte","heb geschikt","Het schikt me beter op vrijdag."
"sluiten","to close - to conclude","sluit","sloot","heb gesloten","We sluiten een nieuw akkoord."
"stellen","to pose - to state","stel","stelde","heb gesteld","Ik stel een heel belangrijke vraag."
"stemmen","to vote","stem","stemde","heb gestemd","Ik stem bij elke verkiezing."
"stichten","to found - to establish","sticht","stichtte","heb gesticht","Hij sticht een gloednieuw bedrijf."
"stimuleren","to stimulate","stimuleer","stimuleerde","heb gestimuleerd","De overheid stimuleert duurzame energie."
"streven","to strive","streef","streefde","heb gestreefd","Wij streven naar een eerlijke samenleving."
"toelaten","to admit - to allow","laat toe","liet toe","heb toegelaten","De school laat dit jaar meer studenten toe."
"toestaan","to allow","sta toe","stond toe","heb toegestaan","De wet staat dit gewoon niet toe."
"uiten","to express","uit","uitte","heb geuit","Hij uit zijn mening heel duidelijk."
"vaststaan","to be certain","staat vast","stond vast","heeft vastgestaan","Het besluit staat nu definitief vast."
"verbieden","to forbid","verbied","verbood","heb verboden","De wet verbiedt roken in cafés."
"verbinden","to connect","verbind","verbond","heb verbonden","De brug verbindt de twee dorpen."
"verdedigen","to defend","verdedig","verdedigde","heb verdedigd","Hij verdedigt zijn standpunt fel."
"vereisen","to require","vereis","vereiste","heb vereist","Deze baan vereist veel ervaring."
"verhinderen","to prevent","verhinder","verhinderde","heb verhinderd","Ziekte verhindert helaas mijn komst."
"verklaren","to explain - to declare","verklaar","verklaarde","heb verklaard","De expert verklaart het vreemde verschijnsel."
"verkrijgen","to obtain","verkrijg","verkreeg","heb verkregen","Je verkrijgt een diploma na het examen."
"verlenen","to grant - to provide","verleen","verleende","heb verleend","De gemeente verleent een vergunning."
"vermoeden","to suspect","vermoed","vermoedde","heb vermoed","Ik vermoed sterk dat hij liegt."
"vernietigen","to destroy","vernietig","vernietigde","heb vernietigd","De brand vernietigt het hele gebouw."
"verplichten","to oblige","verplicht","verplichtte","heb verplicht","De wet verplicht ons tot betalen."
"verraden","to betray","verraad","verried","heb verraden","Hij verraadt zijn beste vriend."
"verschillen","to differ","verschil","verschilde","heb verschild","Onze meningen verschillen sterk."
"verslaan","to defeat","versla","versloeg","heb verslagen","Ons team verslaat de sterke tegenstander."
"verspreiden","to spread","verspreid","verspreidde","heb verspreid","Het virus verspreidt zich heel snel."
"verstoren","to disturb","verstoor","verstoorde","heb verstoord","Het lawaai verstoort de vergadering."
"vertonen","to show - to display","vertoon","vertoonde","heb vertoond","De film vertoont veel zinloos geweld."
"vervangen","to replace","vervang","verving","heb vervangen","Ik vervang de kapotte lamp meteen."
"vervolgen","to continue - to prosecute","vervolg","vervolgde","heb vervolgd","De officier vervolgt de verdachte."
"vervoeren","to transport","vervoer","vervoerde","heb vervoerd","De vrachtwagen vervoert zware goederen."
"verwarren","to confuse","verwar","verwarde","heb verward","Die twee namen verwar ik altijd."
"verwijderen","to remove","verwijder","verwijderde","heb verwijderd","Ik verwijder het oude bestand."
"verwijzen","to refer","verwijs","verwees","heb verwezen","De huisarts verwijst me naar een specialist."
"verzamelen","to collect","verzamel","verzamelde","heb verzameld","Ik verzamel oude, zeldzame postzegels."
"verzekeren","to insure - to assure","verzeker","verzekerde","heb verzekerd","Ik verzeker mijn nieuwe auto goed."
"verzoeken","to request","verzoek","verzocht","heb verzocht","Wij verzoeken u vriendelijk stil te zijn."
"voldoen","to satisfy - to comply","voldoe","voldeed","heb voldaan","Het product voldoet aan alle eisen."
"voorzien","to provide - to foresee","voorzie","voorzag","heb voorzien","We voorzien grote problemen volgend jaar."
"voorspellen","to predict","voorspel","voorspelde","heb voorspeld","De expert voorspelt een diepe crisis."
"vormen","to form","vorm","vormde","heb gevormd","Deze groep vormt een hecht team."
"weergeven","to display - to render","geef weer","gaf weer","heb weergegeven","De grafiek geeft de cijfers helder weer."
"werven","to recruit","werf","wierf","heb geworven","Het bedrijf werft nieuwe medewerkers."
"wijzen","to point","wijs","wees","heb gewezen","Hij wijst naar de dichtstbijzijnde uitgang."
"wijzigen","to modify","wijzig","wijzigde","heb gewijzigd","Ik wijzig mijn reservering nog even."
"zenden","to broadcast - to send","zend","zond","heb gezonden","De zender zendt het nieuws live uit."
"zwijgen","to be silent","zwijg","zweeg","heb gezwegen","Hij zwijgt over het pijnlijke onderwerp."
"aanduiden","to indicate","duid aan","duidde aan","heb aangeduid","De rode pijl duidt de richting aan."
"aanleveren","to deliver - to supply","lever aan","leverde aan","heb aangeleverd","Ik lever de teksten op tijd aan."
"afkeuren","to disapprove - to reject","keur af","keurde af","heb afgekeurd","De keurmeester keurt het product af."
"bedragen","to amount to","bedraagt","bedroeg","heeft bedragen","De totale schade bedraagt duizend euro."
"belichten","to highlight - to illuminate","belicht","belichtte","heb belicht","Het artikel belicht een nieuw probleem."
"beogen","to aim at - to intend","beoog","beoogde","heb beoogd","Wij beogen een betere samenwerking."
"berusten","to rest on - to resign oneself","berust","berustte","heb berust","Het besluit berust op harde feiten."
"bestrijden","to combat","bestrijd","bestreed","heb bestreden","De overheid bestrijdt armoede actief."
"betwisten","to dispute","betwist","betwistte","heb betwist","Ik betwist deze oneerlijke conclusie."
"bezuinigen","to cut costs","bezuinig","bezuinigde","heb bezuinigd","De gemeente bezuinigt op cultuur."
"doorvoeren","to implement","voer door","voerde door","heb doorgevoerd","We voeren de wijziging meteen door."
"hanteren","to handle - to use","hanteer","hanteerde","heb gehanteerd","We hanteren hier heel strenge regels."
"inleiden","to introduce","leid in","leidde in","heb ingeleid","De spreker leidt het onderwerp in."
"kenmerken","to characterize","kenmerk","kenmerkte","heb gekenmerkt","Geduld kenmerkt een goede leraar."
"ondervinden","to experience - to encounter","ondervind","ondervond","heb ondervonden","We ondervinden veel hinder van het werk."
"onderbouwen","to substantiate","onderbouw","onderbouwde","heb onderbouwd","Hij onderbouwt zijn betoog met cijfers."
"opvatten","to interpret - to take up","vat op","vatte op","heb opgevat","Ik vat zijn opmerking verkeerd op."
"ontlopen","to avoid - to escape","ontloop","ontliep","heb ontlopen","Hij ontloopt zijn eigen verantwoordelijkheid."
"rondkomen","to make ends meet","kom rond","kwam rond","ben rondgekomen","Met dit salaris kom ik amper rond."
"toelichten","to clarify","licht toe","lichtte toe","heb toegelicht","Ik licht mijn beslissing kort toe."
"toeschrijven","to attribute","schrijf toe","schreef toe","heb toegeschreven","Men schrijft het succes aan hem toe."
"uitblinken","to excel","blink uit","blonk uit","heb uitgeblonken","Zij blinkt uit in wiskunde."
"uitbreiden","to expand","breid uit","breidde uit","heb uitgebreid","Het bedrijf breidt zijn activiteiten uit."
"uitdagen","to challenge","daag uit","daagde uit","heb uitgedaagd","Hij daagt mij uit voor een wedstrijd."
"uitdrukken","to express","druk uit","drukte uit","heb uitgedrukt","Ik druk mijn gevoelens moeilijk uit."
"uitsluiten","to exclude","sluit uit","sloot uit","heb uitgesloten","We sluiten niemand van deelname uit."
"verbruiken","to consume","verbruik","verbruikte","heb verbruikt","Deze auto verbruikt veel benzine."
"vergoeden","to reimburse","vergoed","vergoedde","heb vergoed","De verzekering vergoedt alle schade."
"verhogen","to raise - to increase","verhoog","verhoogde","heb verhoogd","De baas verhoogt mijn salaris."
"verlagen","to lower","verlaag","verlaagde","heb verlaagd","De winkel verlaagt vandaag de prijzen."
"vernieuwen","to renew - to innovate","vernieuw","vernieuwde","heb vernieuwd","De stad vernieuwt het oude centrum."
"veroordelen","to condemn - to sentence","veroordeel","veroordeelde","heb veroordeeld","De rechter veroordeelt de dader."
"verschaffen","to provide","verschaf","verschafte","heb verschaft","De bank verschaft ons een lening."
"versnellen","to accelerate","versnel","versnelde","heb versneld","We versnellen het hele proces."
"vertragen","to slow down - to delay","vertraag","vertraagde","heb vertraagd","De storm vertraagt het hele verkeer."
"weerspiegelen","to reflect","weerspiegel","weerspiegelde","heb weerspiegeld","De cijfers weerspiegelen de werkelijkheid."
"aangeven","to indicate - to report","geef aan","gaf aan","heb aangegeven","Geef even aan waar je woont."
"aanhouden","to continue - to arrest","houd aan","hield aan","heb aangehouden","De politie houdt de verdachte aan."
"afleggen","to take an exam - to cover distance","leg af","legde af","heb afgelegd","Ik leg morgen mijn rijexamen af."
"nagaan","to check - to verify","ga na","ging na","ben nagegaan","Ik ga na of de cijfers kloppen."
"voortzetten","to continue","zet voort","zette voort","heb voortgezet","We zetten het gesprek later voort."
"samenstellen","to compile - to assemble","stel samen","stelde samen","heb samengesteld","Ik stel een gloednieuw team samen."
"samenvatten","to summarize","vat samen","vatte samen","heb samengevat","Ik vat het lange artikel kort samen."
"doorgeven","to pass on","geef door","gaf door","heb doorgegeven","Ik geef de boodschap aan hem door."
"nalaten","to refrain - to leave behind","laat na","liet na","heb nagelaten","Hij laat na zijn werk af te maken."
"instemmen","to agree - to consent","stem in","stemde in","heb ingestemd","De raad stemt met het plan in."
"deelnemen","to participate","neem deel","nam deel","heb deelgenomen","Veel landen nemen aan de top deel."
"plaatsvinden","to take place","vindt plaats","vond plaats","heeft plaatsgevonden","De vergadering vindt morgen plaats."
"inzetten","to deploy - to use","zet in","zette in","heb ingezet","De gemeente zet meer agenten in."
"doorzetten","to persevere","zet door","zette door","heb doorgezet","Ik zet door, ondanks de tegenslag."
"afzien","to refrain from","zie af","zag af","heb afgezien","We zien voorlopig van het plan af."
"voortvloeien","to result from","vloeit voort","vloeide voort","is voortgevloeid","Uit het onderzoek vloeien nieuwe vragen voort."
"bekendmaken","to announce","maak bekend","maakte bekend","heb bekendgemaakt","De jury maakt de winnaar bekend."
"voortbrengen","to produce - to generate","breng voort","bracht voort","heb voortgebracht","Dit land brengt veel talent voort."
"aanstellen","to appoint","stel aan","stelde aan","heb aangesteld","Het bedrijf stelt een nieuwe manager aan."
"afwegen","to weigh up","weeg af","woog af","heb afgewogen","Ik weeg de voor- en nadelen af."
"bemiddelen","to mediate","bemiddel","bemiddelde","heb bemiddeld","De vakbond bemiddelt in het conflict."
"bekostigen","to fund - to afford","bekostig","bekostigde","heb bekostigd","De ouders bekostigen de dure studie."
"doorlopen","to go through - to complete","doorloop","doorliep","heb doorlopen","Ik doorloop het hele programma."
"inhuren","to hire","huur in","huurde in","heb ingehuurd","We huren een extern bureau in."
"inzien","to realize - to see","zie in","zag in","heb ingezien","Hij ziet zijn fout eindelijk in."
"opbouwen","to build up","bouw op","bouwde op","heb opgebouwd","Ik bouw langzaam een netwerk op."
"ophelderen","to clarify - to solve","helder op","helderde op","heb opgehelderd","De politie heldert de zaak op."
"overheersen","to dominate","overheers","overheerste","heb overheerst","Eén partij overheerst het hele debat."
"raken","to hit - to touch - to affect","raak","raakte","heb geraakt","Het droeve nieuws raakt me diep."
"strekken","to extend - to serve","strek","strekte","heb gestrekt","Dit voorbeeld strekt tot navolging."
"toetsen","to test - to assess","toets","toetste","heb getoetst","We toetsen de kennis van de studenten."
"verbeelden","to imagine - to depict","verbeeld","verbeeldde","heb verbeeld","Het schilderij verbeeldt de oorlog."
"verheugen","to look forward to - to please","verheug","verheugde","heb verheugd","Ik verheug me erg op de vakantie."
"verkennen","to explore","verken","verkende","heb verkend","We verkennen voorzichtig de nieuwe markt."
"verlopen","to proceed - to expire","verloop","verliep","is verlopen","De vergadering verloopt heel soepel."
"vermelden","to mention - to state","vermeld","vermeldde","heb vermeld","Vermeld je naam op het formulier."
"vervullen","to fulfil","vervul","vervulde","heb vervuld","Hij vervult een belangrijke rol."
"wegnemen","to take away - to remove","neem weg","nam weg","heb weggenomen","Dit antwoord neemt mijn twijfel weg."
"weerstaan","to resist","weersta","weerstond","heb weerstaan","Ik kan de verleiding niet weerstaan."
"toedienen","to administer","dien toe","diende toe","heb toegediend","De arts dient het medicijn toe."
"verstrekken","to provide - to issue","verstrek","verstrekte","heb verstrekt","De bank verstrekt ons een hypotheek."
"doelen","to aim - to refer to","doel","doelde","heb gedoeld","Waar doel je nu eigenlijk op?"
"omvatten","to encompass","omvat","omvatte","heb omvat","Het project omvat heel veel taken."
"voortduren","to continue - to persist","duurt voort","duurde voort","heeft voortgeduurd","De droogte duurt veel te lang voort."
"inspelen","to anticipate - to respond","speel in","speelde in","heb ingespeeld","We spelen op de vraag van de klant in."
"opwerpen","to raise - to throw up","werp op","wierp op","heb opgeworpen","Hij werpt een lastige vraag op."
"verwoorden","to put into words","verwoord","verwoordde","heb verwoord","Hij verwoordt zijn kritiek heel helder."
"typeren","to typify","typeer","typeerde","heb getypeerd","Dit gedrag typeert hem volkomen."
"nuanceren","to nuance","nuanceer","nuanceerde","heb genuanceerd","Ik wil dat standpunt graag nuanceren."
"onderkennen","to recognize - to acknowledge","onderken","onderkende","heb onderkend","We onderkennen het gevaar te laat."
"voorschrijven","to prescribe","schrijf voor","schreef voor","heb voorgeschreven","De arts schrijft een kuur voor."
"verruimen","to broaden","verruim","verruimde","heb verruimd","Reizen verruimt echt je blik."
"inkrimpen","to shrink - to downsize","krimp in","kromp in","ben ingekrompen","Het grote bedrijf krimpt sterk in."
"toespitsen","to focus - to sharpen","spits toe","spitste toe","heb toegespitst","Ik spits mijn betoog op één punt toe."
